{
  "after": {
    "directory": "docs/demo/stricter",
    "header": {
      "caller": "deepvariant",
      "reblocked": false,
      "sample": "Example"
    },
    "options": {
      "allow_block_dp": false,
      "allow_unfiltered": false,
      "min_dp": 10.0,
      "min_gq": 40.0
    },
    "quality_checks": {
      "failures": [],
      "passed": true,
      "requested": false
    },
    "reference": {
      "reference": {
        "bytes": 1026,
        "modified_unix_seconds": 1790465439,
        "path": "examples/reference.fa"
      },
      "reference_index": {
        "bytes": 18,
        "modified_unix_seconds": 1790465439,
        "path": "examples/reference.fa.fai"
      }
    },
    "version": "0.4.0"
  },
  "before": {
    "directory": "docs/demo/audit",
    "header": {
      "caller": "deepvariant",
      "reblocked": false,
      "sample": "Example"
    },
    "options": {
      "allow_block_dp": false,
      "allow_unfiltered": false,
      "min_dp": 10.0,
      "min_gq": 20.0
    },
    "quality_checks": {
      "failures": [],
      "passed": true,
      "requested": false
    },
    "reference": {
      "reference": {
        "bytes": 1026,
        "modified_unix_seconds": 1790465439,
        "path": "examples/reference.fa"
      },
      "reference_index": {
        "bytes": 18,
        "modified_unix_seconds": 1790465439,
        "path": "examples/reference.fa.fai"
      }
    },
    "version": "0.4.0"
  },
  "compatibility": {
    "allow_different_samples": false,
    "allow_policy_change": true,
    "assume_same_reference": false,
    "reference_identity_verified": false,
    "same_group_targets": true,
    "same_target_union": true
  },
  "contigs": [
    {
      "after_bases_by_state": {
        "callable_reference": 250,
        "callable_variant": 0,
        "complex_variant": 0,
        "filter_not_assessed": 0,
        "genotype_filtered": 0,
        "low_depth": 180,
        "low_gq": 200,
        "no_call": 50,
        "no_record": 50,
        "overlapping_records": 0,
        "partial_no_call": 0,
        "quality_missing": 0,
        "reference_ambiguous": 20,
        "reference_mismatch": 0,
        "site_filtered": 0,
        "unsupported_allele": 0,
        "unsupported_ploidy": 0
      },
      "after_callable_bases": 250,
      "after_callable_fraction": 0.3333333333333333,
      "bases": 750,
      "bases_by_state_delta": {
        "callable_reference": -199,
        "callable_variant": -1,
        "complex_variant": 0,
        "filter_not_assessed": 0,
        "genotype_filtered": 0,
        "low_depth": 0,
        "low_gq": 200,
        "no_call": 0,
        "no_record": 0,
        "overlapping_records": 0,
        "partial_no_call": 0,
        "quality_missing": 0,
        "reference_ambiguous": 0,
        "reference_mismatch": 0,
        "site_filtered": 0,
        "unsupported_allele": 0,
        "unsupported_ploidy": 0
      },
      "before_bases_by_state": {
        "callable_reference": 449,
        "callable_variant": 1,
        "complex_variant": 0,
        "filter_not_assessed": 0,
        "genotype_filtered": 0,
        "low_depth": 180,
        "low_gq": 0,
        "no_call": 50,
        "no_record": 50,
        "overlapping_records": 0,
        "partial_no_call": 0,
        "quality_missing": 0,
        "reference_ambiguous": 20,
        "reference_mismatch": 0,
        "site_filtered": 0,
        "unsupported_allele": 0,
        "unsupported_ploidy": 0
      },
      "before_callable_bases": 450,
      "before_callable_fraction": 0.6,
      "callable_percentage_point_change": -26.666666666666668,
      "contig": "demo",
      "gained_callable_bases": 0,
      "lost_callable_bases": 200,
      "net_callable_bases": -200
    }
  ],
  "coordinates": "0-based half-open; changes.bed columns: contig, start, end, before_state->after_state",
  "exons": [
    {
      "after_bases_by_state": {
        "callable_reference": 150,
        "callable_variant": 0,
        "complex_variant": 0,
        "filter_not_assessed": 0,
        "genotype_filtered": 0,
        "low_depth": 0,
        "low_gq": 0,
        "no_call": 0,
        "no_record": 0,
        "overlapping_records": 0,
        "partial_no_call": 0,
        "quality_missing": 0,
        "reference_ambiguous": 0,
        "reference_mismatch": 0,
        "site_filtered": 0,
        "unsupported_allele": 0,
        "unsupported_ploidy": 0
      },
      "after_callable_bases": 150,
      "after_callable_fraction": 1.0,
      "bases": 150,
      "bases_by_state_delta": {
        "callable_reference": 0,
        "callable_variant": 0,
        "complex_variant": 0,
        "filter_not_assessed": 0,
        "genotype_filtered": 0,
        "low_depth": 0,
        "low_gq": 0,
        "no_call": 0,
        "no_record": 0,
        "overlapping_records": 0,
        "partial_no_call": 0,
        "quality_missing": 0,
        "reference_ambiguous": 0,
        "reference_mismatch": 0,
        "site_filtered": 0,
        "unsupported_allele": 0,
        "unsupported_ploidy": 0
      },
      "before_bases_by_state": {
        "callable_reference": 150,
        "callable_variant": 0,
        "complex_variant": 0,
        "filter_not_assessed": 0,
        "genotype_filtered": 0,
        "low_depth": 0,
        "low_gq": 0,
        "no_call": 0,
        "no_record": 0,
        "overlapping_records": 0,
        "partial_no_call": 0,
        "quality_missing": 0,
        "reference_ambiguous": 0,
        "reference_mismatch": 0,
        "site_filtered": 0,
        "unsupported_allele": 0,
        "unsupported_ploidy": 0
      },
      "before_callable_bases": 150,
      "before_callable_fraction": 1.0,
      "callable_percentage_point_change": 0.0,
      "contig": "demo",
      "exon": "exon_1",
      "gained_callable_bases": 0,
      "gene": "EXAMPLE_A",
      "intervals": [
        [
          0,
          150
        ]
      ],
      "lost_callable_bases": 0,
      "net_callable_bases": 0
    },
    {
      "after_bases_by_state": {
        "callable_reference": 150,
        "callable_variant": 0,
        "complex_variant": 0,
        "filter_not_assessed": 0,
        "genotype_filtered": 0,
        "low_depth": 0,
        "low_gq": 0,
        "no_call": 0,
        "no_record": 0,
        "overlapping_records": 0,
        "partial_no_call": 0,
        "quality_missing": 0,
        "reference_ambiguous": 0,
        "reference_mismatch": 0,
        "site_filtered": 0,
        "unsupported_allele": 0,
        "unsupported_ploidy": 0
      },
      "after_callable_bases": 150,
      "after_callable_fraction": 1.0,
      "bases": 150,
      "bases_by_state_delta": {
        "callable_reference": 0,
        "callable_variant": 0,
        "complex_variant": 0,
        "filter_not_assessed": 0,
        "genotype_filtered": 0,
        "low_depth": 0,
        "low_gq": 0,
        "no_call": 0,
        "no_record": 0,
        "overlapping_records": 0,
        "partial_no_call": 0,
        "quality_missing": 0,
        "reference_ambiguous": 0,
        "reference_mismatch": 0,
        "site_filtered": 0,
        "unsupported_allele": 0,
        "unsupported_ploidy": 0
      },
      "before_bases_by_state": {
        "callable_reference": 150,
        "callable_variant": 0,
        "complex_variant": 0,
        "filter_not_assessed": 0,
        "genotype_filtered": 0,
        "low_depth": 0,
        "low_gq": 0,
        "no_call": 0,
        "no_record": 0,
        "overlapping_records": 0,
        "partial_no_call": 0,
        "quality_missing": 0,
        "reference_ambiguous": 0,
        "reference_mismatch": 0,
        "site_filtered": 0,
        "unsupported_allele": 0,
        "unsupported_ploidy": 0
      },
      "before_callable_bases": 150,
      "before_callable_fraction": 1.0,
      "callable_percentage_point_change": 0.0,
      "contig": "demo",
      "exon": "exon_2",
      "gained_callable_bases": 0,
      "gene": "EXAMPLE_A",
      "intervals": [
        [
          100,
          250
        ]
      ],
      "lost_callable_bases": 0,
      "net_callable_bases": 0
    },
    {
      "after_bases_by_state": {
        "callable_reference": 0,
        "callable_variant": 0,
        "complex_variant": 0,
        "filter_not_assessed": 0,
        "genotype_filtered": 0,
        "low_depth": 180,
        "low_gq": 0,
        "no_call": 50,
        "no_record": 0,
        "overlapping_records": 0,
        "partial_no_call": 0,
        "quality_missing": 0,
        "reference_ambiguous": 20,
        "reference_mismatch": 0,
        "site_filtered": 0,
        "unsupported_allele": 0,
        "unsupported_ploidy": 0
      },
      "after_callable_bases": 0,
      "after_callable_fraction": 0.0,
      "bases": 250,
      "bases_by_state_delta": {
        "callable_reference": 0,
        "callable_variant": 0,
        "complex_variant": 0,
        "filter_not_assessed": 0,
        "genotype_filtered": 0,
        "low_depth": 0,
        "low_gq": 0,
        "no_call": 0,
        "no_record": 0,
        "overlapping_records": 0,
        "partial_no_call": 0,
        "quality_missing": 0,
        "reference_ambiguous": 0,
        "reference_mismatch": 0,
        "site_filtered": 0,
        "unsupported_allele": 0,
        "unsupported_ploidy": 0
      },
      "before_bases_by_state": {
        "callable_reference": 0,
        "callable_variant": 0,
        "complex_variant": 0,
        "filter_not_assessed": 0,
        "genotype_filtered": 0,
        "low_depth": 180,
        "low_gq": 0,
        "no_call": 50,
        "no_record": 0,
        "overlapping_records": 0,
        "partial_no_call": 0,
        "quality_missing": 0,
        "reference_ambiguous": 20,
        "reference_mismatch": 0,
        "site_filtered": 0,
        "unsupported_allele": 0,
        "unsupported_ploidy": 0
      },
      "before_callable_bases": 0,
      "before_callable_fraction": 0.0,
      "callable_percentage_point_change": 0.0,
      "contig": "demo",